name	page_title	model	body	icon	icon_alt_text	taxonomy	slideshow_image	slideshow_text	special_target	adress
Прицепной опрыскиватель AMAZONE UX	Прицепной опрыскиватель AMAZONE UX	ux	<style>.imagecache-product {display: none;}</style><div class="single caption"> <img src="/sites/default/files/ux-1.jpg"></div><p>Прицепной опрыскиватель AMAZONE UX&nbsp;&mdash; это компактный опрыскиватель со&nbsp;сравнительно малым весом и&nbsp;низким центром тяжести. Серия UX&nbsp;состоит из&nbsp;четырёх прицепных опрыскивателей, которые отличаются друг от&nbsp;друга различным объёмом бака. Фактический объём бака составляет 3.600 литров на&nbsp;UX&nbsp;3200, 4.600 литров на&nbsp;UX&nbsp;4200, 5.600 литров на&nbsp;UX&nbsp;5200, 6.600 литров на&nbsp;UX&nbsp;6200 и&nbsp;12.000 литров на&nbsp;UX&nbsp;11200.<br>Для опрыскивателя UX&nbsp;3200 и&nbsp;4200 имеются модификации Special и&nbsp;Super, для UX&nbsp;5200 и&nbsp;6200 только Super. Значительное отличие между версиями Special и&nbsp;Super&nbsp;&mdash; это насосная техника: так, UX&nbsp;Special оснащена одним насосом, тогда как UX&nbsp;Super с&nbsp;двумя насосами мощностью 430 и&nbsp;530&nbsp;л/мин предлагает для баков любого объёма гибкость и&nbsp;уверенность в&nbsp;будущем.<br>Опрыскиватели UX&nbsp;3200 Special и&nbsp;4200 Special с&nbsp;одним насосом (280&nbsp;л/мин) подходят для средних хозяйств, занимающихся откормочным животноводством и&nbsp;выращиванием зерновых, которые предпочитают опрыскиватели с&nbsp;максимальным объёмом бака 3.600 или 4.600&nbsp;литров, а&nbsp;также шириной захвата штанг от&nbsp;15&nbsp;до&nbsp;28&nbsp;метров. Модификация Super рекомендуется тогда, когда из-за большой ширины захвата (&gt; 24&nbsp;м) или большого расхода (&gt; 250&nbsp;л/га) требуется высокая мощность насоса.<br>Опрыскиватель UX&nbsp;Special с&nbsp;шириной захвата от&nbsp;15&nbsp;до&nbsp;28&nbsp;метров оснащён хорошо зарекомендовавшими себя штангами Super-S. Машины UX&nbsp;Super с&nbsp;шириной захвата от&nbsp;24&nbsp;до&nbsp;40&nbsp;метров со&nbsp;штангами Super-L могут быть оснащены двумя насосами.</p><table class="specs"><thead><tr><th>Модель</th><th>UX3200<br>Special</th><th>UX3200<br>Super</th><th>UX4200<br>Special</th><th>UX4200<br>Super</th><th>UX5200<br>Super</th><th>UX6200<br>Super</th></tr></thead><tbody><tr><td>Фактический обьем, л</td><td colspan="2">3600</td><td colspan="2">4200</td><td colspan="2">6200</td></tr><tr><td>Бак с чистой водой, л</td><td colspan="2">320</td><td colspan="4">550</td></tr><tr><td>Ширина, м</td><td>15—28</td><td>18—36</td><td>15—28</td><td colspan="2">18—40</td><td>17—40</td></tr><tr><td>Высота, м</td><td colspan="6">Штанги Super-S —3,22; Super-L — 3,35</td></tr><tr><td>Длинна при траспортировке, м</td><td colspan="2">6,25</td><td colspan="4">6,8</td></tr><tr><td>Транспортная ширина, м</td><td colspan="6">Штанги Super-S и Super-L — 2,40; Super-L — 2,6</td></tr><tr><td>Собственная масса, кг</td><td>3000—3400</td><td>3100—4000</td><td colspan="2">3100—4100</td><td>3200—4200</td><td>3300—4300</td></tr><tr><td>Производительность насосов, л/мин</td><td>280</td><td>430</td><td>280</td><td>430 или 530</td><td colspan="2">530</td></tr><tr><td>Производительность всасывания, л/мин</td><td>400</td><td>600</td><td>400</td><td>600 или 700</td><td colspan="2">700</td></tr><tr><td>Дорожний просвет около<br>(с шинами 340/85 R48), м</td><td colspan="6">0,78</td></tr><tr><td>Высота опрыскивания<br>(с шинами 340/85 R48), м</td><td colspan="6">0,5—2,5</td></tr><tr><td>Максимальное<br>рабочее давление, бар</td><td colspan="6">&lt;10</td></tr></tbody></table>	ux-1.jpg	Прицепной опрыскиватель AMAZONE UX	AMAZONE				amazone-ux
Комбинация культиватора и дисковой бороны — Centaur.	Комбинация культиватора и дисковой бороны — Centaur.	centaur	<style>.imagecache-product {display: none;}</style><div class="single caption"> <img src="/sites/default/files/centaur-1.jpg"></div><p>Вам нужна многофункциональная почвообрабатывающая машина? Машина для поверхностной обработки почвы, обработки стерни, основной обработки почвы и глубокого рыхления? AMAZONE предлагает Вам идеальное решение — комбинированный агрегат Centaur с шириной захвата 3 м, 4 м и 5 м!<br>Убедитесь сами в надёжности и лёгкости конструкции Centaur, даже при тяжёлых условиях он способен интенсивно перемешивать растительные остатки с почвой. Благодаря четырёхрядному расположению рабочих органов и значительной высоте рамы Centaur обеспечит Вам работу без неполадок и засорения — и при сниженном расходе топлива!</p><h2>Особенности</h2><ul><li>широкий спектр применения – от поверхностной обработки стерни до глубокого рыхления почвы;</li><li>перемешивание, выравнивание и крошение почвы при помощи двух рядов сферических дисков с эластичными резиновыми элементами;</li><li>уплотнение почвы после прохода агрегата посредством клиновидных шин;</li><li>оптимальное качество обработки почвы благодаря применению различных рабочих органов в зависимости от глубины обработки;</li><li>стабильная глубина обработки за счёт применения опорных колес спереди и прикатывающих катков сзади.</li></ul><div class="imagecaption"><img class="img1" src="/sites/defaults/files/centaur-2.jpg"><img class="img2" src="/sites/defaults/files/centaur-3.jpg"><img class="img3" src="/sites/defaults/files/centaur-4.jpg"></div><h2>Технические характеристики</h2><table class="specs"><thead><tr><th>Модель</th><th>Centaur 3001<br> Super</th><th>Centaur 4001<br> Super</th><th>Centaur 4001-2<br> Super</th><th>Centaur 5001-2<br> Super</th></tr></thead><tbody><tr><td>Конструкция</td><td colspan="2">жесткая</td><td colspan="2">складная</td></tr><tr><td>Ширина захвата, м</td><td>3,00</td><td colspan="2">4,00</td><td>5,00</td></tr><tr><td>Рабочая скорость, км/час</td><td colspan="4">8—15</td></tr><tr><td>Скорость при транспортировке, км/час</td><td colspan="2">25</td><td colspan="2">25/40</td></tr><tr><td>Количество рядов лап</td><td colspan="4">4 смещенных</td></tr><tr><td>Количество лап</td><td>15</td><td colspan="2">19</td><td>24</td></tr><tr><td>Шаги следа лап, мм</td><td>200</td><td colspan="3">210</td></tr><tr><td>Количество дисков</td><td>22</td><td colspan="2">30</td><td>38</td></tr><tr><td>Диаметр дисков, мм</td><td colspan="4">460</td></tr><tr><td>Шины</td><td colspan="4">400/50—15.5</td></tr><tr><td>Навеска трактора</td><td colspan="4">Нижние тяги кат.3</td></tr><tr><td>Требуемая мощность от, кВт/л.с</td><td>110/150</td><td colspan="2">147/200</td><td>185/250</td></tr><tr><td>Транспортная длина, м</td><td colspan="2">8,30</td><td colspan="2">9,35</td></tr><tr><td>Транспортная ширина, м</td><td>3,00</td><td>4,00</td><td colspan="2">3,00</td></tr><tr><td>Транспортная высота, м</td><td colspan="2">2,00</td><td>2,80</td><td>3,10</td></tr><tr><td>Масса, кг</td><td>4400</td><td>5700</td><td>7720</td><td>8500</td></tr></tbody></table>	Centaur-4.jpg	Комбинация культиватора и дисковой бороны — Centaur.	AMAZONE				amazone-centaur
Пропашные сеялки AMAZONE EDX	Пропашные сеялки AMAZONE EDX	edx	<style>.imagecache-product {display: none;}</style><div class="single caption"><img src="/sites/default/files/edx-1.jpg"></div><p>С&nbsp;сеялками точного высева EDX&nbsp;AMAZONE предлагает новую технологию, которая позволяет развивать скорость от&nbsp;10&nbsp;до&nbsp;15&nbsp;км/час с&nbsp;аналогичным качеством укладки семян. Благодаря дальнейшим техническим новинкам и&nbsp;удобству в&nbsp;управлении сокращается также время на&nbsp;загрузку и&nbsp;настройку машины.<br>В&nbsp;сравнении с&nbsp;традиционными сеялками точного высева сеялки класса EDX обеспечивают производительность, которая при сравнимом качестве укладки оказывается на&nbsp;30&ndash;50% выше. Это значительно улучшает не&nbsp;только дееспособность, но&nbsp;и&nbsp;одновременно снижает издержки на&nbsp;использование трактора и&nbsp;оплату труда механизатора.</p><div class="single caption"><img src="/sites/default/files/edx-2.jpg"></div><div class="single caption"><img src="/sites/default/files/edx-3.jpg"></div><h2>Аргументы говорят сами за себя.</h2><ul><li>Комплексная программа для хозяйств с различной структурой.</li><li>Скорость работы до 15 км/ч.</li><li>Большой бункер для удобрений и посевного материала.</li><li>Быстрое заполнение, опустошение и замена посевного материала за счёт центрального семенного бункера.</li><li>Быстрое заполнение бункера для удобрений.</li><li>Централизованное регулирование отсекателей, опция с дистанционным управлением для AMATRON+.</li><li>Централизованное гидравлическое регулирование давления на сошник, опция с дистанционным управлением для AMATRON+.</li><li>Упрощённая настройка нормы внесения удобрений.</li><li>Центральный терминал управления всеми функциями AMATRON+.</li><li>Компактное и быстрое складывание, максимальная транспортная ширина 3 м.</li><li>Подходит для посева после вспашки, мульчированного и прямого посева.</li><li>Выполняются требования земельного кадастра по эрозии, возможен узкорядный посев.</li><li>Возможен посев кукурузы, подсолнечника и рапса.</li></ul><div class="single caption"><img src="/sites/default/files/edx-4.jpg"></div><h2>Технические характеристики</h2><table class="specs"><thead><tr><th>Модель</th><th>EDX 6000-2C</th><th>EDX 6000-2FC</th><th>EDX 6000-2</th><th>EDX 6000-TC</th><th>EDX 9000-TC</th></tr></thead><tbody><tr><td>Ширина захвата<br>(междурядье 75 см)</td><td>6 м</td><td>6 м</td><td>6 м</td><td>6 м</td><td>9 м</td></tr><tr><td>Транспортная ширина</td><td>3 м</td><td>3 м</td><td>3 м</td><td>3 м</td><td>3 м</td></tr><tr><td>Скорость работы</td><td colspan="5">от 8 до 15 км/ч</td></tr><tr><td>Объем бункера для удобрений, л</td><td>1100</td><td>1500/2.000</td><td>3000</td><td>5000</td></tr><tr><td>Объем семенного бункера, л</td><td>360</td><td>400</td><td>400</td><td>600</td><td>2&times;400</td></tr><tr><td>Количество высевающих агрегатов<br>(междурядье 75 см)</td><td>8</td><td>8</td><td>8</td><td>8</td><td>12</td></tr><tr><td>Возможность значения междурядий в см</td><td>70, 75, 80</td><td>37.5, 44.9, (45), 50, 55, 70, 75, 80</td><td>37.5, 44.9, (45), 50, 55, 70, 75, 80</td><td>37.5, 44.9, (45), 50, 55, 70, 75, 80</td><td>37.5, 44.9, (45), 50, 55, 70, 75, 80</td></tr><tr><td>Максимальное количество под почвенный горизонт</td><td>8</td><td>16</td><td>16</td><td>16</td><td>20</td></tr><tr><td>Тяговая потребность</td><td colspan="4">От 170 л.с/ 125 кВт</td><td>От 170 л.с/ 125 кВт</td></tr></tbody></table><div class="single caption"><img src="/sites/default/files/edx-5.jpg"></div><h2>Базовая комплектация машин</h2><p>Агрегат состоит из 4 секций:</p> <ul><li>опорные колеса для выдерживания рабочей глубины и&nbsp;гашения продольных колебаний;</li><li>4&nbsp;ряда рабочих органов на&nbsp;патентированных 3D-стойках с&nbsp;пружинной защитой от&nbsp;камней (2&nbsp;спиральные пружины, благодаря которым стойки уходят от&nbsp;препятствий не&nbsp;только назад, но&nbsp;и&nbsp;в&nbsp;сторону), стойки в&nbsp;ряду установлены со&nbsp;смещением для дополнительного увеличения свободного пространства между лапами, сами шарниры крепления не&nbsp;требуют смазки;</li><li>2&nbsp;ряда сферических дисков &Oslash;&nbsp;460&nbsp;мм, каждый диск на&nbsp;своем подшипнике, не&nbsp;требующем обслуживания, и&nbsp;резиновом демпферном элементе, не&nbsp;нуждающимся в&nbsp;смазывании;</li><li>клиновидные шины, имеющие функцию прикатывающего катка и&nbsp;шасси. Клиновидная форма поверхности катка обеспечивает уплотнение почвы в&nbsp;виде полос, что позволяет достичь эффекта чередование уплотненных и&nbsp;рыхлых участков для одновременного обеспечения защиты от&nbsp;эрозии, закрытия влаги при сохранении доступа воздуха и&nbsp;осадков к&nbsp;нижним слоям грунта</li><li>несущая складывающаяся рама для навески на&nbsp;трактора KAT III;</li><li>приборы освещения и&nbsp;сигнализации;</li><li>механическая настройка глубины обработки: дисковой секции посредством рычага с&nbsp;храповым механизмом, лаповой секции&nbsp;&mdash; перекидных дистанционных шайб;</li><li>рабочие органы</li><li>комплект оборотных лемехов шириной 75&nbsp;мм (24&nbsp;шт.);</li><li>комплект узких рабочих органов 55&nbsp;мм (24&nbsp;шт.);</li><li>инструкция по&nbsp;эксплуатации;</li><li>без тормозной системы.</li></ul><div class="single caption"><img src="/sites/default/files/edx-6.jpg"></div>	edx-1.jpg	Пропашные сеялки AMAZONE EDX	AMAZONE				amazone-edx
Сеялки точного высева AMAZONE ED	Сеялки точного высева AMAZONE ED	ed	<style>.imagecache-product {display: none;}</style><div class="single caption"><img src="/sites/default/files/ed.jpg"></div><p>Сеялки точного высева фирмы AMAZONE тщательно согласованы с&nbsp;требованиями крупных предприятий и&nbsp;предпринимателей. Они особенно разносторонне в&nbsp;применении и&nbsp;отличаются высокой эффективностью и&nbsp;надежностью при оптимальном качестве работы. Рабочая скорость до&nbsp;9&nbsp;км/ч, согласно profi&nbsp;&mdash; тесту, не&nbsp;составляет больших трудностей. Сеялки точного высева фирмы AMAZONE являются очень стабильными, и&nbsp;в&nbsp;тоже время, простые и&nbsp;удобные в&nbsp;обслуживании. Кроме того, они убеждают своей точностью посева, надежностью и&nbsp;ценностью.</p><h3>Техническая характеристика</h3><table class="specs"><thead><tr><td>Тип</th><td colspan="2">ED 302</th><td colspan="2">ED 302</th><td colspan="2">ED 302</th><td colspan="2">ED 302</th></tr></thead><tbody><tr><td>Высевающий агрегат</td><td>Classic</td><td>Control</td><td>Classic</td><td>Control</td><td>Classic</td><td>Control</td><td>Classic</td><td>Control</td></tr><tr><td>Варианты шин</td><td colspan="8">10,0/75-15 31&times;15,5/15</td></tr><tr><td>Длинна с прикатывающим диском 370 мм</td><td colspan="4">2,4 м</td><td colspan="2">2,8 м</td><td colspan="2">2,9 м</td></tr><tr><td>Количество высевающих аппаратов в стандартной модели (ширина междурядья 75 см)</td><td colspan="2">4</td><td colspan="4">6</td><td colspan="2">8</td></tr><tr><td>Количество высевающих аппаратов,максимальное, с/без подпочвенного внесения удобрений</td><td>10/6</td><td>6/6</td><td>12/6</td><td>9/6</td><td colspan="2">7/6</td><td>12/8-12</td></tr><tr><td>Приводной механизм</td><td colspan="8">54 ступенчатая цепная передача (серия )</td></tr><tr><td>Расстояние между зернами</td><td colspan="8">От 3,1 см до 86,9 см в зависимости от приминяемого дозирующего диска</td></tr><tr><td>Емкость бункера для удобрений, л</td><td colspan="2">650</td><td colspan="4">900</td><td colspan="2">1100</td></tr><tr><td>Высота загрузки бункера для удобрений, м</td><td colspan="2">1,60</td><td colspan="4">1,68</td><td colspan="2">1,85</td></tr><tr><td>Привод вентилятора</td><td colspan="8">Карданный вал с обгонной муфтой,частота вращения ВОМ 540 об/мин 710 об/мин 1000 об/ мин на выбор гидравлический привод вентилятора</td></tr><tr><td>Дозирующий орган</td><td colspan="8">Пластиковые дозирующие диски для кукурузы,рапса,сахарной свеклы,подсолнечника,гороха,и пр.</td></tr><tr><td>Собственная масса без рядкового растениепитателя от, кг</td><td>662</td><td>798</td><td>824</td><td>1028</td><td>903</td><td>1107</td><td>1337</td><td>1606</td></tr><tr><td>Собственная масса с рядковым растениепитателя от, кг</td><td>814</td><td>986</td><td>1021</td><td>1225</td><td>1100</td><td>1350</td><td>1697</td><td>2112</td></tr><tr><td>Собственная масса фронтального бункера</td><td colspan="8">640 кг</td></tr></tbody></table>	ed.jpg	Сеялки точного высева AMAZONE ED	AMAZONE				amazone-ed
Высокопроизводительные сеялки AMAZONE Citan	Высокопроизводительные сеялки AMAZONE Citan	citan	<style>.imagecache-product {display: none;}</style><div class="single caption"><img src="/sites/default/files/citan.jpg"></div><p>С&nbsp;сеялкой Citan AMAZONE предлагает разделение процесса обработки почвы и&nbsp;посева с&nbsp;шириной захвата от&nbsp;6&nbsp;до&nbsp;15&nbsp;м. Citan позволяет оптимально устанавливать сроки сева. Низкое давление на&nbsp;почву и&nbsp;производительный посев являются важнейшими преимуществами в&nbsp;современных, узких севооборотах. За&nbsp;счёт отделения обработки почвы семенное ложе может полноценно сформироваться, и&nbsp;закрытие борозды для появления дружных всходов будет обеспечено. Производительность сеялки Citan с&nbsp;шириной захвата 15&nbsp;м может достичь 15&nbsp;га/ч. Некоторые пользователи выделяют ещё один, важный в&nbsp;севообороте озимых, положительный аспект: сошники Citan вызывают незначительные движения почвы, поэтому и&nbsp;стимулирование новых сорняков (прежде всего, полевого лисохвоста) сводится к&nbsp;минимуму.</p><table class="specs"><thead><tr><th>Тип</th><th>Citan 8000</th><th>Citan 9000</th><th>Citan 12000</th></tr></thead><tbody><tr><td>Транспортная длина, м</td><td>8,7</td><td>8,7</td><td>10,2</td></tr><tr><td>Рабочая скорость, км/час</td><td>10,0—20,0</td><td>10,0―20,0</td><td>10,0―20,0</td></tr><tr><td>Производительность, га/час</td><td>6,0―8,0</td><td>7,0―9,0</td><td>10,0―12,0</td></tr><tr><td>Рекомендуемая тяговая мощность, кВт/л.с</td><td>От 110/150</td><td>От 130/170</td><td>От 170/225</td></tr><tr><td>Объём семенного бункера, л</td><td>5,00</td><td>5,00</td><td>5,00</td></tr><tr><td>Навеска</td><td colspan="3">Нижние тяги КАТ &#8546; или КАТ &#8547;</td></tr><tr><td>Масса, кг</td><td>6,25</td><td>6,6</td><td>7,6</td></tr><tr><td>Ширина междурядий, см</td><td>12,5</td><td>12,5</td><td>12,5</td></tr></tbody></table>	citan.jpg	Высокопроизводительные сеялки AMAZONE Citan	AMAZONE				amazone-citan
